{
    "$schema": "https://json-schema.org/draft/2020-12/schema",
    "$id": "https://bora-employer-pipeline.local/schemas/job.schema.json",
    "title": "Bora Employer Pipeline Job Record",
    "description": "Canonical structured record for one discovered job in the Bora Employer Pipeline OS. This schema stores verified source facts and explicit unknown states. It must not infer missing facts.",
    "type": "object",
    "additionalProperties": false,
  
    "required": [
      "job_id",
      "company",
      "role",
      "official_url",
      "discovery_url",
      "location",
      "work_arrangement",
      "employment_type",
      "discovered_date",
      "date_first_seen",
      "date_last_verified",
      "role_status",
      "source_verification_status",
      "role_family",
      "seniority",
      "jd_snapshot",
      "work_authorization_wording",
      "opt_flag",
      "e_verify_result",
      "evidence_matches",
      "major_gaps",
      "lane",
      "decision",
      "resume_version",
      "network_action",
      "application_status",
      "outcome"
    ],
  
    "properties": {
      "job_id": {
        "type": "string",
        "minLength": 1,
        "description": "Permanent unique identifier assigned deterministically by the system."
      },
  
      "company": {
        "type": "string",
        "minLength": 1
      },
  
      "role": {
        "type": "string",
        "minLength": 1
      },
  
      "official_url": {
        "type": ["string", "null"],
        "format": "uri",
        "description": "Employer-owned careers-page URL when verified. Null if unavailable or not yet found."
      },
  
      "discovery_url": {
        "type": ["string", "null"],
        "format": "uri",
        "description": "URL where the role was originally discovered, if available."
      },
  
      "location": {
        "type": ["string", "null"],
        "description": "Location exactly as verified from the source. Null if not provided."
      },
  
      "work_arrangement": {
        "type": "string",
        "enum": [
          "ONSITE",
          "HYBRID",
          "REMOTE",
          "UNKNOWN"
        ]
      },
  
      "employment_type": {
        "type": "string",
        "enum": [
          "FULL_TIME",
          "PART_TIME",
          "CONTRACT",
          "W2_CONTRACT",
          "TEMPORARY",
          "CONTRACT_TO_HIRE",
          "INTERNSHIP",
          "OTHER",
          "UNKNOWN"
        ]
      },
  
      "board_posted_date": {
        "type": ["string", "null"],
        "format": "date",
        "description": "Posting date displayed by the discovery source when available."
      },
  
      "discovered_date": {
        "type": "string",
        "format": "date",
        "description": "Date the role was discovered by the pipeline. Stored separately from first-seen and board-posted dates."
      },
  
      "date_first_seen": {
        "type": "string",
        "format": "date",
        "description": "Date the role was first seen as a live posting. Must not be collapsed into discovered_date."
      },
  
      "date_last_verified": {
        "type": "string",
        "format": "date",
        "description": "Most recent date the role's live/source status was verified."
      },
  
      "careers_page_status": {
        "type": "string",
        "enum": [
          "FOUND",
          "NOT_FOUND",
          "NOT_CHECKED",
          "UNKNOWN"
        ]
      },
  
      "repost_evidence": {
        "type": ["string", "null"],
        "description": "Verified reposting or contradictory-date evidence. Null when no such evidence is available."
      },
  
      "role_status": {
        "type": "string",
        "enum": [
          "VERIFIED_LIVE",
          "LIKELY_LIVE",
          "UNCLEAR",
          "POSSIBLY_STALE",
          "CONFIRMED_CLOSED"
        ],
        "description": "Role freshness classification only (Blueprint §20/§21). Independent from source_verification_status. Must not classify a job as stale or fake from one weak signal."
      },
  
      "source_verification_status": {
        "type": "string",
        "enum": [
          "VERIFIED_DIRECT",
          "SOURCE_VERIFICATION_REQUIRED",
          "DIRECT_SOURCE_UNAVAILABLE",
          "UNKNOWN"
        ],
        "description": "Direct-source verification axis (Blueprint §19), stored separately from role_status. Allowed values are implementation vocabulary, not Blueprint-locked terminology. Do not infer role_status from this field or vice versa."
      },
  
      "role_family": {
        "type": ["string", "null"],
        "description": "Functional role family assigned during analysis. Null until classified."
      },
  
      "seniority": {
        "type": ["string", "null"],
        "description": "Seniority as supported by the posting. Null if unclear rather than guessed."
      },
  
      "jd_snapshot": {
        "type": "string",
        "minLength": 1,
        "description": "Snapshot of the job description used for analysis."
      },
  
      "work_authorization_wording": {
        "type": ["string", "null"],
        "description": "Exact or faithfully captured work-authorization language from the source. This is descriptive evidence, not a legal conclusion."
      },
  
      "sponsorship_wording": {
        "type": ["string", "null"],
        "description": "Exact or faithfully captured sponsorship-related language from the source when present."
      },
  
      "opt_flag": {
        "type": "string",
        "enum": [
          "POTENTIALLY_RELEVANT",
          "POTENTIALLY_NOT_RELEVANT",
          "UNKNOWN"
        ],
        "description": "Screening signal only. It must not be treated as a legal determination of OPT eligibility."
      },
  
      "initial_opt_relevance": {
        "type": "string",
        "enum": [
          "STRONG",
          "MODERATE",
          "WEAK",
          "UNKNOWN"
        ],
        "description": "Career/degree relevance assessment for initial OPT. Legal certainty is handled separately."
      },
  
      "future_stem_quality": {
        "type": "string",
        "enum": [
          "STRONG",
          "MODERATE",
          "WEAK",
          "UNKNOWN"
        ],
        "description": "Strategic quality for a potential future STEM OPT pathway. Must remain separate from initial OPT relevance."
      },
  
      "immigration_verification_status": {
        "type": "string",
        "enum": [
          "NOT_REQUIRED",
          "VERIFIED",
          "LEGAL_VERIFICATION_REQUIRED",
          "HR_CONFIRMATION_REQUIRED",
          "UNKNOWN"
        ],
        "description": "Verification state for consequential immigration-related conclusions."
      },
  
      "e_verify_result": {
        "type": "string",
        "enum": [
          "CONFIRMED",
          "SEARCH_MATCH_FOUND",
          "NOT_FOUND_IN_PUBLIC_SEARCH",
          "UNKNOWN",
          "HR_CONFIRMATION_NEEDED"
        ],
        "description": "E-Verify result. NOT_FOUND_IN_PUBLIC_SEARCH must never be converted into NOT_ENROLLED."
      },
  
      "evidence_matches": {
        "type": "array",
        "items": {
          "type": "string",
          "minLength": 1
        },
        "description": "Identifiers for evidence-match records associated with this job."
      },
  
      "major_gaps": {
        "type": "array",
        "items": {
          "type": "string",
          "minLength": 1
        },
        "description": "Material gaps that remain after evidence matching. Must not be hidden or creatively solved."
      },
  
      "lane": {
        "type": "string",
        "enum": [
          "LANE_0_REJECT",
          "LANE_1_EFFICIENT_APPLY",
          "LANE_2_PRIORITY_APPLY",
          "WATCH",
          "UNASSIGNED"
        ]
      },
  
      "decision": {
        "type": "string",
        "enum": [
          "PRIORITY_APPLY",
          "APPLY",
          "EFFICIENT_APPLY",
          "WATCH",
          "REJECT",
          "UNDECIDED"
        ]
      },
  
      "resume_version": {
        "type": ["string", "null"],
        "description": "Identifier of the derivative resume version associated with the job. Null before generation."
      },
  
      "network_action": {
        "type": ["string", "null"],
        "description": "Reference to the approved networking action or recommendation. Null when none exists."
      },
  
      "application_status": {
        "type": "string",
        "enum": [
          "NOT_STARTED",
          "PREPARING",
          "READY_FOR_REVIEW",
          "SUBMITTED",
          "INTERVIEWING",
          "REJECTED",
          "WITHDRAWN",
          "OFFER",
          "CLOSED",
          "UNKNOWN"
        ]
      },
  
      "outcome": {
        "type": "string",
        "enum": [
          "UNKNOWN",
          "NO_RESPONSE",
          "REJECTED",
          "SCREEN",
          "INTERVIEW",
          "FINAL_INTERVIEW",
          "OFFER",
          "ACCEPTED",
          "DECLINED",
          "WITHDRAWN",
          "CLOSED"
        ]
      }
    }
  }