{
  "job_id": "JOB_CASE_F_JD_SOFTWARE_JPM_JUNIOR_PROJECT_MANAGER",
  "company": "JD Software",
  "role": "Junior Project Manager",
  "official_url": "https://www.jdsoft.com/career-jpm.html",
  "discovery_url": null,
  "location": "Salem, MA",
  "work_arrangement": "UNKNOWN",
  "employment_type": "UNKNOWN",
  "board_posted_date": null,
  "discovered_date": "2026-09-02",
  "date_first_seen": "2026-09-02",
  "date_last_verified": "2026-09-03",
  "careers_page_status": "FOUND",
  "repost_evidence": null,
  "role_status": "VERIFIED_LIVE",
  "source_verification_status": "VERIFIED_DIRECT",
  "role_family": null,
  "seniority": null,
  "jd_snapshot": "RECOVERED 2026-09-03 via direct tool-mediated fetch of the target URL (jdsoft.com, JD Software's own first-party careers page). Job Title (verbatim): 'Junior Project Manager'. Employer: JD Software. Location: Salem, MA (company address: 27 Congress Street, Suite 1310, Salem, MA 01970). No posting date, closing date, or compensation figure stated on the page. Responsibilities section (heading verbatim 'Responsibilities will include'): develop project deliverables/status reports/work products; provide regular status updates to clients; record/triage/track/escalate client issues; lead client meetings and product demonstrations; develop and document client requirements; serve as main point of contact for multiple clients; develop strong working knowledge of all systems supported by the company. Candidate-profile section (heading verbatim 'Ideally, we are looking for candidates who possess the following requirements and credentials:'): excellent organization skills; excellent written and verbal communication skills; self-directed yet reports to the Senior Technical Project Manager; prior project management experience using both Agile and Waterfall techniques in IT-related projects; knowledge of the Software Development Life Cycle (SDLC); demonstrated ability to work directly with diverse business and technical teams; 'BS in a relevant discipline or, an equivalent combination of education, training, and experience' (verbatim, no quantitative substitution rule stated for the equivalent-combination branch); Project Management Professional (PMP) or Project Management Institute (PMI) certification is a plus; experience in public sector IT consulting a plus; knowledge of the management of public sector licensing and permitting processes is a plus. No work-authorization, sponsorship, or E-Verify wording found anywhere on the page (exhaustive read). No application questions/portal found -- application is by direct email to careers@jdsoft.com. Full retrieved text is recorded in jd.txt in this same fixture directory.",
  "work_authorization_wording": null,
  "sponsorship_wording": null,
  "opt_flag": "UNKNOWN",
  "e_verify_result": "UNKNOWN",
  "evidence_matches": [],
  "major_gaps": [],
  "lane": "UNASSIGNED",
  "decision": "UNDECIDED",
  "resume_version": null,
  "network_action": null,
  "application_status": "NOT_STARTED",
  "outcome": "UNKNOWN"
}
