{
  "job_id": "JOB_CASE_E_MBTA_CONTRACTOR_APPLICATION_ANALYST",
  "company": "Massachusetts Bay Transportation Authority (MBTA)",
  "role": "Application Analyst - Digital Workplace (Contractor Position)",
  "official_url": "https://www.governmentjobs.com/careers/mbtama/jobs/5436565-0/application-analyst-digital-workplace-contractor-position",
  "discovery_url": null,
  "location": "10 Park Plaza, Boston, MA",
  "work_arrangement": "HYBRID",
  "employment_type": "CONTRACT",
  "board_posted_date": "2026-08-04",
  "discovered_date": "2026-08-31",
  "date_first_seen": "2026-08-31",
  "date_last_verified": "2026-08-31",
  "careers_page_status": "FOUND",
  "repost_evidence": null,
  "role_status": "VERIFIED_LIVE",
  "source_verification_status": "VERIFIED_DIRECT",
  "role_family": null,
  "seniority": null,
  "jd_snapshot": "RECOVERED 2026-08-31 via tool-mediated fetch of the target URL (governmentjobs.com, MBTA's official first-party applicant-tracking system, contractor-postings section). Job Number 20260804A-ITS87 (official identifier -- preserved here in prose and in capture_notes.md; job.schema.json has no dedicated structured requisition-ID field, so no schema change was made). Job Title (verbatim): 'Application Analyst - Digital Workplace (Contractor Position)'. Opening Date: 08/04/2026. Closing Date: Continuous (no fixed end date stated). Compensation: $48.00 hourly. Posting organization: Massachusetts Bay Transportation Authority. Location: 10 Park Plaza, Boston, hybrid arrangement requiring 'at least two (2) days per week' in-office (explicit). Employment Status Clarification (verbatim, explicit source statement): this position is 'not employed directly by the MBTA' and represents 'a term-limited and project-specific contractor position.' No staffing agency, vendor, or other named legal employer is stated anywhere on the retrieved page -- the posting discloses that MBTA is NOT the direct employer without disclosing who is. Minimum Qualifications observed (same substantive core as the direct posting, independently reworded on this separate page, not copy-pasted from CASE_D): Bachelor's degree from accredited institution; three years of experience in system analysis, including enterprise application design, configuration/development, implementation, and support; ability to map and document complex business processes; experience identifying and documenting business rules and technical requirements; foundational knowledge of cloud-based application delivery models (SaaS); IT service management/ticketing systems experience; strong interpersonal and communication skills; Microsoft Office suite proficiency. Work Authorization (verbatim, as retrieved): candidates must be 'legally authorized to work in the United States' on an unrestricted basis; the posting states MBTA 'does not have an employer work sponsorship program' -- notable internal tension: this sponsorship disclaimer is attributed to MBTA even though the same posting explicitly states the worker is not employed directly by MBTA, so it is not established from this text alone whether the no-sponsorship statement legally binds the actual (unnamed) employer of record; recorded as-observed, no legal conclusion drawn. Full retrieved text and retrieval method are recorded in jd.txt and capture_notes.md in this same fixture directory.",
  "work_authorization_wording": "Candidates must be legally authorized to work in the United States on an unrestricted basis. The MBTA does not have an employer work sponsorship program.",
  "sponsorship_wording": "The MBTA does not have an employer work sponsorship program. (Note: posting explicitly states the worker is not employed directly by MBTA; the actual legal employer/staffing vehicle is not named on the retrieved page, so it is not established that this sponsorship statement binds that unnamed employer of record -- see jd_snapshot and capture_notes.md.)",
  "opt_flag": "UNKNOWN",
  "e_verify_result": "UNKNOWN",
  "evidence_matches": [],
  "major_gaps": [],
  "lane": "UNASSIGNED",
  "decision": "UNDECIDED",
  "resume_version": null,
  "network_action": null,
  "application_status": "NOT_STARTED",
  "outcome": "UNKNOWN"
}
