{
  "job_id": "JOB_CASE_D_MBTA_DIRECT_APPLICATION_ANALYST",
  "company": "Massachusetts Bay Transportation Authority (MBTA)",
  "role": "Application Analyst (Digital Workplace)",
  "official_url": "https://www.governmentjobs.com/careers/mbtama/jobs/5449649/application-analyst-digital-workplace",
  "discovery_url": null,
  "location": "10 Park Plaza, Boston, MA",
  "work_arrangement": "UNKNOWN",
  "employment_type": "FULL_TIME",
  "board_posted_date": "2026-08-24",
  "discovered_date": "2026-08-31",
  "date_first_seen": "2026-08-31",
  "date_last_verified": "2026-08-31",
  "careers_page_status": "FOUND",
  "repost_evidence": null,
  "role_status": "VERIFIED_LIVE",
  "source_verification_status": "VERIFIED_DIRECT",
  "role_family": null,
  "seniority": null,
  "jd_snapshot": "RECOVERED 2026-08-31 via direct tool-mediated fetch of the target URL (governmentjobs.com, MBTA's official first-party applicant-tracking system). Job Number 26-20235 (official MBTA requisition identifier -- preserved here in prose; job.schema.json has no dedicated structured requisition-ID field, so this is the smallest truthful place to record it without a schema change; also recorded in capture_notes.md). Job Title (verbatim): 'Application Analyst (Digital Workplace)'. Employer: Massachusetts Bay Transportation Authority. Location: 10 Park Plaza, Boston. Employment Type: Full-Time. Opening Date: 08/24/2026. Closing Date: 9/7/2026 11:59 PM Eastern. Minimum Qualifications (verbatim, two separate sentences as written on the source -- NOT a single AND-conjoined clause): 'Bachelor's degree from an accredited institution.' 'Three (3) years of experience in system analysis, including enterprise application design, configuration / development, implementation, and support.' Substitution structure (verbatim): 'A High School Diploma or GED with an additional seven (7) years of directly related experience substitutes for the Bachelor's degree requirement. An Associate's degree from an accredited institution an additional three (3) years of directly related experience substitutes for the Bachelor's degree requirement. A Master's degree in a related subject substitute for two (2) years of general experience. A nationally recognized certification, or statewide/professional certification in a related field substitutes for one year of experience.' Required Skills (verbatim): 'Proven ability to map and document complex business processes and identify opportunities for optimization or automation within assigned applications. Experience identifying and documenting business rules and technical requirements. Foundational knowledge of cloud-based application delivery models such as Software as a Service (SaaS) and / or technology infrastructure concepts.' Plus: experience with IT service management / ticketing systems; strong Microsoft Office proficiency (Word, Excel, Outlook, PowerPoint, Teams). Preferred: direct experience with Comply365, Document Management Systems, HR, LMS, IDP; Microsoft Power Platform (Power Automate, Power Apps) development/governance/administration; API management and data integration tools; Microsoft 365 governance and security; Power BI or Tableau reporting; public transit/transportation industry background. Work arrangement: not stated as onsite/hybrid/remote by an explicit dedicated sentence; the only related language found is 'Ability to commute to assigned work locations in the Boston, MA metro area, as required by the role.' -- treated as insufficient to assert a specific work_arrangement enum value, so work_arrangement is recorded UNKNOWN rather than guessed. Supplemental Questionnaire Q1 (education/experience substitution ladder, verbatim options): 'Did not attain a high school diploma or equivalent.' / 'High School Diploma/ equivalent with ten (10) or more years of experience in system analysis, including enterprise application design, configuration / development, implementation, and support.' / 'An associates degree from an accredited institution with six (6) or more years of experience in system analysis, including enterprise application design, configuration / development, implementation, and support.' / \"A bachelor's degree with three (3) or more years of experience in system analysis, including enterprise application design, configuration / development, implementation, and support.\" / \"A master's degree and one (1) or more years of experience in system analysis, including enterprise application design, configuration / development, implementation, and support.\" Q2 (verbatim): 'Do you have Experience with IT service management / ticketing systems?' (Yes/No). Q3 (verbatim): 'Do you have foundational knowledge of cloud-based application delivery models such as Software as a Service (SaaS) and / or technology infrastructure concepts?' (Yes/No). Q4 (verbatim): 'Do you have experience mapping and documenting complex business processes and identify opportunities for optimization or automation within assigned applications?' (Yes/No). Q5 (verbatim): 'Are you legally authorized to work in the United States?' (Yes/No). Q6 (verbatim): 'Will you now or in the future require visa sponsorship to continue working in the United States (e.g. H-1B visa status)?' (Yes/No). Full retrieved text and retrieval method are recorded in jd.txt and capture_notes.md in this same fixture directory.",
  "work_authorization_wording": "All employees must be legally authorized to work in the United States and on an unrestricted basis. The MBTA does not have an employer work sponsorship program.",
  "sponsorship_wording": "The MBTA does not have an employer work sponsorship program.",
  "opt_flag": "UNKNOWN",
  "e_verify_result": "UNKNOWN",
  "evidence_matches": [],
  "major_gaps": [],
  "lane": "UNASSIGNED",
  "decision": "UNDECIDED",
  "resume_version": null,
  "network_action": null,
  "application_status": "NOT_STARTED",
  "outcome": "UNKNOWN"
}
