{
  "job_id": "JOB_CASE_A_ATOMINVEST_IMPLEMENTATION_ANALYST",
  "company": "Atominvest",
  "role": "Implementation Analyst",
  "official_url": "https://jobs.ashbyhq.com/atominvest/c7469459-426c-405c-a178-db8421c8b3ec?embed=js",
  "discovery_url": null,
  "location": "New York City, New York, United States (primary); Boston (secondary)",
  "work_arrangement": "HYBRID",
  "employment_type": "FULL_TIME",
  "board_posted_date": "2026-08-05",
  "discovered_date": "2026-08-31",
  "date_first_seen": "2026-08-31",
  "date_last_verified": "2026-08-31",
  "careers_page_status": "FOUND",
  "repost_evidence": null,
  "role_status": "VERIFIED_LIVE",
  "source_verification_status": "VERIFIED_DIRECT",
  "role_family": null,
  "seniority": null,
  "jd_snapshot": "RECOVERED 2026-08-31 via direct HTTP GET of the target URL (raw retrieval; earlier tool-mediated fetch had only exposed the page title). Verbatim from the employer's own embedded posting data: title 'Implementation Analyst', identifier c7469459-426c-405c-a178-db8421c8b3ec (exact target match), department/team 'Customer Success', primary location New York City (New York, United States), secondary location Boston, workplaceType 'Hybrid', employmentType 'FullTime', datePosted 2026-08-05, isListed=true, isConfidential=false. Requirements observed: Bachelor's degree (or higher) from a top-tier university, 0-2 years experience, strong Excel/data comfort, SQL/API exposure described as a plus not a requirement, private-markets interest. No visa/sponsorship/citizenship/clearance/E-Verify/OPT wording found anywhere in the full retrieved page (exhaustive text search) -- UNKNOWN remains the correct policy status; absence of wording is not evidence of no policy. A separate, differently-ID'd Implementation Analyst posting (London) remains independently observed on the same employer's board; both are preserved as distinct, non-contradictory observations -- see capture_notes.md. Full verbatim text in jd.txt in this same fixture directory.",
  "work_authorization_wording": null,
  "sponsorship_wording": null,
  "opt_flag": "UNKNOWN",
  "e_verify_result": "UNKNOWN",
  "evidence_matches": [],
  "major_gaps": [],
  "lane": "UNASSIGNED",
  "decision": "UNDECIDED",
  "resume_version": null,
  "network_action": null,
  "application_status": "NOT_STARTED",
  "outcome": "UNKNOWN"
}
