{
  "job_id": "JOB_CASE_G_JD_SOFTWARE_IA_IMPLEMENTATION_ANALYST",
  "company": "JD Software",
  "role": "Implementation Analyst",
  "official_url": "https://www.jdsoft.com/career-ia.html",
  "discovery_url": null,
  "location": "Salem, MA",
  "work_arrangement": "UNKNOWN",
  "employment_type": "UNKNOWN",
  "board_posted_date": null,
  "discovered_date": "2026-09-03",
  "date_first_seen": "2026-09-03",
  "date_last_verified": "2026-09-03",
  "careers_page_status": "FOUND",
  "repost_evidence": null,
  "role_status": "VERIFIED_LIVE",
  "source_verification_status": "VERIFIED_DIRECT",
  "role_family": null,
  "seniority": null,
  "jd_snapshot": "RECOVERED 2026-09-03 via direct tool-mediated fetch of the target URL (jdsoft.com, JD Software's own first-party careers page). Job Title (verbatim): 'Implementation Analyst'. Employer: JD Software. Location: Salem, MA (company address: 27 Congress Street, Suite 1310, Salem, MA 01970). No posting date, closing date, or compensation figure stated on the page. Responsibilities section (heading verbatim 'Key Responsibilities'): configure/customize the electronic licensing platform; analyze client requirements into structured system configurations including conditional logic, data mappings, and workflow states; develop strong working knowledge of the arc eLicensing platform; collaborate with project managers and engineers; support testing activities; investigate/troubleshoot configuration-related issues; assist in documenting business requirements, configuration decisions, and system changes. Candidate-profile section (heading verbatim, exact curly apostrophe as rendered by the source page, 'What We’re Looking For'): strong analytical skills and the ability to reason through business rules, logical conditions, and workflow scenarios; detail-oriented, with the ability to identify edge cases and evaluate how rule changes impact the system; ability to understand and work with structured information such as datasets, Boolean logic, and conditionals; comfort presenting to external stakeholders, including government officials; excellent written and verbal communication skills; 'BS in a relevant discipline such as Mathematics or Computer Science OR an equivalent combination of education, training, and experience' (verbatim, no quantitative substitution rule stated for the equivalent-combination branch); experience with a Relational Database Management System (such as Postgres, Oracle, SQLServer, or MySQL) a plus. No work-authorization, sponsorship, or E-Verify wording found anywhere on the page (exhaustive read). No application questions/portal found -- application is by direct email to careers@jdsoft.com. Full retrieved text is recorded in jd.txt in this same fixture directory. Source re-verified byte-identical across two independent fetches (2026-09-03, during POST_CANDIDATE_PROFILE_CANONICAL_JD_SOFTWARE_IA_RECHECK_V1 and again immediately before this fixture's authoring) -- no material posting change.",
  "work_authorization_wording": null,
  "sponsorship_wording": null,
  "opt_flag": "UNKNOWN",
  "e_verify_result": "UNKNOWN",
  "evidence_matches": [],
  "major_gaps": [],
  "lane": "UNASSIGNED",
  "decision": "UNDECIDED",
  "resume_version": null,
  "network_action": null,
  "application_status": "NOT_STARTED",
  "outcome": "UNKNOWN"
}
